{
  "version": "1.0",
  "view": "top_down_3_4",
  "art_style": "pixel_art_32",
  "palette_mood": "rural_school_1990s",
  "lighting": "midday_bright",
  "weather_tags": ["clear_sky"],
  "era_tags": ["late_1990s", "rural_school"],
  "atmosphere": "nostalgic",
  "forbidden": ["text_in_image", "watermark", "extra_scene_elements"]
}
